{
  "$schema": "./games.schema.json",
  "version": 2,
  "owner": "astrnox",
  "updatedAt": "2026-10-01",

  "categories": [
    { "id": "puzzle",   "name": "益智" },
    { "id": "casual",   "name": "休闲" },
    { "id": "action",   "name": "动作" },
    { "id": "arcade",   "name": "街机" },
    { "id": "strategy", "name": "策略" },
    { "id": "board",    "name": "棋牌" },
    { "id": "shooter",  "name": "射击" },
    { "id": "io",       "name": ".io" },
    { "id": "sports",   "name": "体育" },
    { "id": "retro",    "name": "怀旧" },
    { "id": "word",     "name": "文字" },
    { "id": "geo",      "name": "地理" }
  ],

  "games": [
    {
      "id": "2048",
      "title": "2048 合集",
      "alias": ["2048", "二四八", "数字合并"],
      "desc": "多种玩法，一种经典。数字合并游戏的合集版。",
      "cover": "assets/covers/2048.svg",
      "readmeLangs": { "default": "zh", "available": ["zh"] },
      "accent": 210,
      "category": ["puzzle", "casual", "arcade"],
      "tags": ["益智", "数字", "合成", "单指"],
      "mode": "redirect",
      "url": "https://2048.xns.asia/",
      "repo": "https://github.com/astrnox/2048",
      "platform": ["web"],
      "featured": true,
      "addedAt": "2026-08-21",
      "source": "own",
      "status": "active",
      "embedCheck": { "checkedAt": "2026-10-01", "result": "unknown" }
    },
    {
      "id": "hextris",
      "title": "Hextris 六边形俄罗斯方块",
      "alias": ["Hextris", "六边形", "hex"],
      "desc": "六边形旋转方块，节奏明快的高分挑战。",
      "cover": "assets/covers/hextris.svg",
      "readmeLangs": { "default": "en", "available": ["en", "zh"] },
      "accent": 280,
      "category": ["arcade", "puzzle", "casual"],
      "tags": ["街机", "反应", "高分", "六边形"],
      "mode": "embed",
      "url": "https://hextris.io/",
      "repo": "https://github.com/astrnox/hextris",
      "platform": ["web"],
      "featured": true,
      "addedAt": "2026-10-01",
      "source": "fork",
      "status": "active",
      "embedCheck": { "checkedAt": "2026-10-01", "result": "unknown" },
      "note": "仓库含 CNAME 指向 hextris.io，该域名为上游所有"
    },
    {
      "id": "tower-game",
      "title": "Tower Game 叠塔",
      "alias": ["tower", "叠塔", "建塔"],
      "desc": "时机精准地叠放方块，塔越高越刺激。",
      "cover": "assets/covers/tower-game.svg",
      "readmeLangs": { "default": "en", "available": ["en", "zh"] },
      "accent": 195,
      "category": ["casual", "arcade"],
      "tags": ["休闲", "单指", "时机", "叠塔"],
      "mode": "embed",
      "url": "https://astrnox.github.io/tower_game/",
      "repo": "https://github.com/astrnox/tower_game",
      "platform": ["web"],
      "featured": true,
      "addedAt": "2026-10-01",
      "source": "fork",
      "status": "active",
      "embedCheck": { "checkedAt": "2026-10-01", "result": "unknown" }
    },
    {
      "id": "plants-vs-zombies",
      "title": "植物大战僵尸 H5",
      "alias": ["pvz", "植物大战僵尸", "plants"],
      "desc": "经典塔防玩法的网页复刻版。",
      "cover": "assets/covers/plants-vs-zombies.svg",
      "readmeLangs": { "default": "zh", "available": ["zh"] },
      "accent": 120,
      "category": ["strategy", "casual"],
      "tags": ["塔防", "经典", "策略"],
      "mode": "embed",
      "url": "https://astrnox.github.io/h5-game-plantsVSzombies/",
      "repo": "https://github.com/astrnox/h5-game-plantsVSzombies",
      "platform": ["web"],
      "featured": true,
      "addedAt": "2026-10-01",
      "source": "fork",
      "status": "active",
      "embedCheck": { "checkedAt": "2026-10-01", "result": "unknown" }
    },
    {
      "id": "trust",
      "title": "Trust",
      "alias": ["trust", "信任"],
      "desc": "独立的网页小游戏作品。",
      "cover": "assets/covers/trust.svg",
      "readmeLangs": { "default": "en", "available": ["en", "zh"] },
      "accent": 45,
      "category": ["casual"],
      "tags": ["休闲", "独立"],
      "mode": "embed",
      "url": "https://astrnox.github.io/trust/",
      "repo": "https://github.com/astrnox/trust",
      "platform": ["web"],
      "featured": false,
      "addedAt": "2026-10-01",
      "source": "own",
      "status": "active",
      "embedCheck": { "checkedAt": "2026-10-01", "result": "unknown" }
    },

    {
      "id": "temple-of-boom",
      "title": "Temple of Boom",
      "alias": ["temple", "神庙", "boom"],
      "desc": "动作闯关类网页游戏。",
      "cover": "assets/covers/temple-of-boom.svg",
      "readmeLangs": { "default": "en", "available": ["en", "zh"] },
      "accent": 20,
      "category": ["action", "arcade"],
      "tags": ["动作", "闯关"],
      "mode": "embed",
      "url": "https://astrnox.github.io/temple-of-boom/",
      "repo": "https://github.com/astrnox/temple-of-boom",
      "platform": ["web"],
      "featured": true,
      "addedAt": "2026-10-01",
      "source": "fork",
      "status": "active",
      "embedCheck": { "checkedAt": "2026-10-01", "result": "unknown" }
    },
    {
      "id": "wordle-plus",
      "title": "Wordle Plus",
      "alias": ["wordle", "猜词", "单词"],
      "desc": "猜单词游戏，每行一词逐步逼近答案。",
      "cover": "assets/covers/wordle-plus.svg",
      "readmeLangs": { "default": "en", "available": ["en", "zh"] },
      "accent": 155,
      "category": ["word", "puzzle"],
      "tags": ["文字", "猜词", "益智"],
      "mode": "embed",
      "url": "https://astrnox.github.io/wordle-plus/",
      "repo": "https://github.com/astrnox/wordle-plus",
      "platform": ["web"],
      "featured": false,
      "addedAt": "2026-10-01",
      "source": "fork",
      "status": "active",
      "embedCheck": { "checkedAt": "2026-10-01", "result": "unknown" }
    },
    {
      "id": "odd-bot-out",
      "title": "Odd Bot Out",
      "alias": ["odd bot", "找出不同"],
      "desc": "从机器人堆里找出与众不同的那一个。",
      "cover": "assets/covers/odd-bot-out.svg",
      "readmeLangs": { "default": "en", "available": ["en", "zh"] },
      "accent": 330,
      "category": ["puzzle", "casual"],
      "tags": ["观察", "益智", "找不同"],
      "mode": "embed",
      "url": "https://astrnox.github.io/odd-bot-out/",
      "repo": "https://github.com/astrnox/odd-bot-out",
      "platform": ["web"],
      "featured": false,
      "addedAt": "2026-10-01",
      "source": "fork",
      "status": "active",
      "embedCheck": { "checkedAt": "2026-10-01", "result": "unknown" }
    },
    {
      "id": "bubble-shooter",
      "title": "Bubble Shooter 泡泡龙",
      "alias": ["bubble", "泡泡龙", "消泡泡"],
      "desc": "经典泡泡龙玩法，三消击破整片泡泡。",
      "cover": "assets/covers/bubble-shooter.svg",
      "readmeLangs": { "default": "en", "available": ["en", "zh"] },
      "accent": 265,
      "category": ["arcade", "puzzle"],
      "tags": ["街机", "消除", "经典"],
      "mode": "embed",
      "url": "https://astrnox.github.io/arkadiumx27s-bubble-shooter/",
      "repo": "https://github.com/astrnox/arkadiumx27s-bubble-shooter",
      "platform": ["web"],
      "featured": false,
      "addedAt": "2026-10-01",
      "source": "fork",
      "status": "active",
      "embedCheck": { "checkedAt": "2026-10-01", "result": "unknown" }
    },
    {
      "id": "10-minutes-till-dawn",
      "title": "10 Minutes Till Dawn",
      "alias": ["10 minutes", "黎明前十分钟"],
      "desc": "生存射击，在怪物潮中撑过十分钟。",
      "cover": "assets/covers/10-minutes-till-dawn.svg",
      "readmeLangs": { "default": "en", "available": ["en", "zh"] },
      "accent": 250,
      "category": ["shooter", "action"],
      "tags": ["射击", "生存", "Roguelike"],
      "mode": "embed",
      "url": "https://astrnox.github.io/10-minutes-till-dawn/",
      "repo": "https://github.com/astrnox/10-minutes-till-dawn",
      "platform": ["web"],
      "featured": true,
      "addedAt": "2026-10-01",
      "source": "fork",
      "status": "active",
      "embedCheck": { "checkedAt": "2026-10-01", "result": "unknown" }
    },

    {
      "id": "fcgame",
      "title": "FCGame · FC/NES 模拟器",
      "alias": ["fc", "nes", "红白机", "模拟器"],
      "desc": "基于 JSNES 的网页模拟器，支持导入本地 ROM。",
      "cover": "assets/covers/fcgame.svg",
      "readmeLangs": { "default": "zh", "available": ["zh"] },
      "accent": 0,
      "category": ["retro", "arcade"],
      "tags": ["模拟器", "红白机", "怀旧", "ROM"],
      "mode": "redirect",
      "url": "https://github.com/astrnox/fcgame",
      "repo": "https://github.com/astrnox/fcgame",
      "platform": ["web"],
      "featured": true,
      "addedAt": "2026-10-01",
      "source": "fork",
      "status": "active",
      "note": "需先部署到 Pages/Docker；仅内置合规 Homebrew ROM，不内置商业 ROM"
    },

    {
      "id": "worldguessr",
      "title": "WorldGuessr 猜地理",
      "alias": ["worldguessr", "猜地图", "geo"],
      "desc": "街景猜地点的地理问答游戏（需服务端）。",
      "cover": "assets/covers/worldguessr.svg",
      "readmeLangs": { "default": "en", "available": ["en", "zh"] },
      "accent": 205,
      "category": ["geo", "casual"],
      "tags": ["地理", "猜谜", "街景"],
      "mode": "redirect",
      "url": "https://github.com/astrnox/worldguessr",
      "repo": "https://github.com/astrnox/worldguessr",
      "upstream": "https://github.com/codergautam/worldguessr",
      "platform": ["web"],
      "featured": false,
      "addedAt": "2026-10-01",
      "source": "fork",
      "status": "active",
      "note": "Next.js + Node 服务端项目，GitHub Pages 无法直接运行"
    },
    {
      "id": "remake",
      "title": "Remake",
      "alias": ["remake", "重制"],
      "desc": "pnpm monorepo 前端项目，需构建后部署。",
      "cover": "assets/covers/remake.svg",
      "readmeLangs": { "default": "en", "available": ["en", "zh"] },
      "accent": 175,
      "category": ["casual"],
      "tags": ["待构建", "monorepo"],
      "mode": "redirect",
      "url": "https://github.com/astrnox/remake",
      "repo": "https://github.com/astrnox/remake",
      "platform": ["web"],
      "featured": false,
      "addedAt": "2026-10-01",
      "source": "own",
      "status": "active",
      "note": "需 pnpm build 产出 dist 后才能部署"
    },
    {
      "id": "fluid-weiqi-web",
      "title": "Fluid 围棋",
      "alias": ["围棋", "weiqi", "go", "fluid"],
      "desc": "围棋对战前端，含构建流程与服务端配置。",
      "cover": "assets/covers/fluid-weiqi-web.svg",